<?xml version="1.1" encoding="UTF-8" standalone="no"?>

<!DOCTYPE scores SYSTEM "./demo-dtd.dtd">

<scores>
    <score>
        <game nb-player="4">
            <Uno />
        </game>
        <point id="score_01_aude" total-ref="total_aude" name="Aude">255</point>
        <point id="score_01_michael" total-ref="total_michael" name="Michael">249</point>
        <point id="score_01_thierry" total-ref="total_thierry" name="Thierry">125</point>
        <point id="score_01_sam" total-ref="total_sam" name="Samuel">0</point>
    </score>
    <score>
        <game nb-player="4">
            <Dames />
        </game>
        <point id="score_02_aude" total-ref="total_aude" name="Aude">42</point>
        <point id="score_02_michael" total-ref="total_michael" name="Michael">13</point>
        <point id="score_02_thierry" total-ref="total_thierry" name="Thierry">2</point>
        <point id="score_02_sam" total-ref="total_sam" name="Samuel">255</point>
    </score>
    <total>
        <point id="total_aude" name="Aude">297</point>
        <point id="total_michael" name="Michael">262</point>
        <point id="total_thierry" name="Thierry">127</point>
        <point id="total_sam" name="Samuel">255</point>
    </total>
</scores>