<?xml version="1.1" encoding="UTF-8" standalone="no"?>

<!DOCTYPE scores SYSTEM "./demo-dtd.dtd">

<scores>
    <score>
        <game nb-player="2">
            <Uno />
        </game>
        <point name="Sam" id="score_01_sam" total-ref="total_sam">255</point>
        <point name="Aude" id="score_01_aude" total-ref="total_aude">0</point>
    </score>
    <total>
        <point name="Sam" id="total_sam">255</point>
        <point name="Aude" id="total_aude">0</point>
    </total>
</scores>